{
  "apiVersion": "harness.planeon.ai/pack-rule/v1alpha1",
  "kind": "PackRule",
  "id": "white-goods.data.block-unready",
  "stage": "data-readiness",
  "when": {
    "any": [
      {"in": ["answers.data-readiness-evaluator-state", ["warn", "fail"]]},
      {"eq": ["answers.tenant-readiness-policy-approved", false]}
    ]
  },
  "action": {
    "type": "BLOCK_READINESS",
    "target": "white-goods.data.readiness",
    "message": "Data readiness remains blocked until deterministic evidence passes under a tenant-approved policy."
  }
}
